id,FrameName,English,French,German,Spanish,Portuguese,Arabic,Chinese,Swedish
841,Ingredients,"wurst.n, pirana.n, cheese.n, tenderloin.n, turkey.n, chigueiro.n, citron.n, cabbage.n, legume.n, cucumber.n, material.n, wine.n, pork loin.n, loin.n, baccala.n, beer.n, wheat.n, pineapple.n, mango.n, fecula.n, dendê.n, spice.n, loaf of bread.n, yellow mombin.n, pumpkin.n, prime rib.n, cracklings.n, rump cap.n, cassava.n, element.n, paio.n, drinking chocolate.n, sardina.n, frankfurter.n, bacuri.n, component.n, tapioca.n, jerked meat.n, pirucucu.n, shrimp.n, peach.n, coconut.n, clabber.n, rice.n, chili sauce.n, coffee.n, sugar cane.n, ora-pro-nóbis.n, chinese parsley.n, asparagus.n, salt cod.n, palm oil.n, paçoca.n, squeaky cheese.n, crawfish.n, broccoli.n, beef broth.n, cupuacu.n, jerky.n, pomegranate.n, flour.n, aguardiente.n, codfish.n, hen.n, cod.n, boar.n, pork knee.n, orange.n, potato.n, courato.n, cinnamon.n, chicken breast.n, coriander.n, fruit.n, cocoa solids.n, cocoa bean.n, avocado.n, tortelli.n, lobster.n, condensed milk.n, amylum.n, cayenne.n, pernil.n, onion.n, rib bone.n, imbu.n, paracress.n, nut.n, bacon.n, tucumã.n, guaraná.n, chocolate.n, açaí.n, chili pepper.n, strawberry.n, shark.n, carbohydrate.n, fish.n, cilantro.n, whale.n, ingredient.n, h2o.n, prawn.n, pequi.n, catupiry.n, milk.n, refined sugar.n, mouton.n, pacú.n, draught beer.n, tucunare.n, lemon.n, pear.n, crawdad.n, ketchup.n, weenie.n, honey.n, artichoke.n, chocolate powder.n, manjar.n, chocolate sprinkles.n, shiitake.n, shellfish.n, yerba mate.n, sheepmeat.n, sardine.n, chop.n, dulce de leche.n, nutella.n, wasabi.n, jackfruit.n, sirloin cap.n, tomato.n, crayfish.n, meat.n, jalapeno.n, vegies.n, butter.n, sardelle.n, wiener.n, minced lard.n, gorgonzola.n, sausage.n, sugarcane.n, cassava flour.n, mangaba.n, lamb.n, bun.n, bullion cube.n, veg.n, tapioca flour.n, rump cover.n, canjiquinha.n, tucupi juice.n, mushroom.n, crabmeat.n, clove.n, starch.n, cachaça.n, wienerwurst.n, curdled.n, leaflard.n, pignoli.n, sugar.n, draft beer.n, grapefruit.n, crustacean.n, anchovy.n, espresso.n, bread.n, skrei.n, grape.n, walnut.n, steak.n, egg.n, wors.n, crab.n, sapodilla.n, cashew.n, corn.n, pinon nut.n, plantain.n, sirloin.n, coriander seed.n, mayonnaise.n, hot chocolate.n, picanha.n, poulet.n, cheddar.n, trace.n, bean.n, chicken.n, pilchard.n, loaf.n, salad vegetables.n, precursor.n, pimentus.n, banana.n, ale.n, sugar lumps.n, cooking plantain.n, coullote.n, murici.n, water.n, salmon.n, seasoning.n, greens.n, soy.n, hotdog.n, dried meat.n, buriti.n, olive oil.n, whiting.n, radish.n, veggie.n, chayote.n, manioc.n, dried cod.n, sea food.n, okra.n, dried soup.n, capybara.n",,"Material.n, Vorläufer.n, Zutaten.n, Zutat.n","azúcar.n, cubito, fruto.n, harina.n, longaniza.n, cajeta.n, yuplon.n, cupuassu.n, filete.n, pequi.n, salchicha.n, ananás.n, chicozapote.n, cebolla.n, abadejo.n, nance.n, mangaba.n, alubia.n, nancite.n, yerba, salmón.n, mantequilla.n, yaca.n, papa.n, paiche.n, bamia.n, gorgonzola.n, okra.n, cumare.n, aceite.n, ora-pro-nóbis.n, ácana.n, pavo.n, oliva.n, piraña.n, harina, pernil.n, canjiquinha.n, dientes.n, palma.n, jobo.n, perejil, chuleta.n, azaí.n, poroto.n, aderezo.n, cheddar.n, tortelli.n, jabalí.n, charque.n, manjar, de, espesante, piña.n, café.n, tapioca.n, candia.n, del, cilantro.n, paçoca.n, acaguru.n, plátano.n, los, changunga.n, tomate.n, macho.n, cátchup.n, frijol.n, mahonesa.n, mandioca.n, en, molondrón.n, cátsup.n, nuez.n, calabaza.n, leche.n, manjar.n, açaí.n, casabe.n, condimento.n, dulce, clavo.n, vino.n, tiburón.n, umbú.n, coriandro.n, arapaima.n, wurst.n, pacupeba.n, aguaje.n, wasabi.n, habichuela.n, queso.n, lomo.n, cacao, agua.n, paio.n, mayonesa.n, cichla.n, crustáceo.n, chayote.n, condensada.n, paracress.n, pechuga, mate.n, maíz.n, bacuri.n, pacú.n, granulado.n, anacardo.n, gamba.n, codillo, capibara.n, repollo.n, tucumã.n, copoazú.n, fruta.n, europeo.n, langosta.n, cordero.n, bovril.n, caña, mango.n, nanche.n, pollo.n, bife.n, cupuazú.n, chuchu.n, hierba, pan.n, tapa, nutella.n, naidí.n, aipim.n, cangrejo.n, cuajada.n, eatau.n, papa, quimbombó.n, cidra.n, polvo.n, shiitake.n, culantro, anchoa.n, leche, marisco.n, chocolate.n, gombo.n, nangka.n, chocolate, hobo.n, aire.n, cachaza.n, tucupí.n, alcoyure.n, bacalao.n, miel.n, patata.n, guacamota.n, ronsoco.n, dania.n, sardina.n, güisquil.n, aguardiente.n, kétchup.n, aceite, yuca.n, cerveza.n, cerdo.n, nuez, abelmosco.n, plátano, manteca, copoasu.n, legumbre.n, chicharrón.n, pirarucu.n, chigüireo.n, ocra.n, cuadril.n, judia.n, moriche.n, chino.n, caguil.n, erizo.n, coco.n, merey.n, blanco.n, caldo.n, caraota.n, cacao.n, carpincho.n, huevo.n, arequipe.n, nanjea.n, panapén.n, carne.n, guaraná.n, jack.n, .n, fideos, costilla.n, chigüiro.n, marañón.n, arroz.n, casava.n, piñon.n, tocino.n, pisco.n, catupiry.n, canela.n, guajolote.n, boquerón.n, quingombó.n, manteca.n, chicle.n, souari.n, hortaliza.n, cajú.n, pimienta.n, pescado.n","fruto.n, cação.n, costela.n, badejo.n, fígado.n, lagarto.n, lagostim.n, tucunaré.n, pequi.n, carneiro.n, macaxeira.n, azeite de oliva.n, iogurte.n, farinha de mandioca.n, mangaba.n, sal.n, salsichão.n, ingrediente.n, javali.n, mel.n, feijão.n, ketchup.n, aveia.n, , leitar.v, gorgonzola.n, maniva.n, alho.n, cacau.n, ora-pro-nóbis.n, chantilly.n, abacate.n, manteiga.n, pernil.n, bacalhau.n, banha de porco.n, abacaxi.n, estômago.n, camarão.n, morango.n, repolho.n, sobrecoxa.n, chantili.n, maionese.n, cana-de-açúcar.n, cheddar.n, erva.n, tortelli.n, charque.n, aguardente.n, carne-seca.n, pulmão.n, dendê.n, café.n, tapioca.n, steak.n, paçoca.n, anis.n, picanha.n, chocolate granulado.n, tempero.n, leite.n, água.n, peru.n, noz.n, farinha.n, cremar.v, lagosta.n, shoyu.n, tomate.n, contra-filé.n, mandioca.n, testículo.n, coalhada.n, cravo.n, moranga.n, açaí.n, foca.n, joelho de porco.n, lombo.n, wurst.n, coentro.n, salsicha.n, caldo de carne.n, polvilho.n, álcool.n, wasabi.n, búfalo.n, murici.n, linguiça.n, paio.n, umbu.n, chocolate em pó.n, cavaquinha.n, cachaça.n, crustáceo.n, azeite.n, produto.n, açúcar.n, componente.a, manga.n, bacuri.n, vegetal.n, leite condensado.n, tucumã.n, hortelã.n, fruta.n, fécula.n, pinhão.n, anchova.n, bife.n, chuchu.n, massa.n, açúcar de confeiteiro.n, nutella.n, galinha.n, aipim.n, cajá.n, óleo.n, vinho.n, macaxeira-brava.n, marisco.n, chocolate.n, cereal.n, bacon.n, banana-da-terra.n, linguiça calabresa.n, mandioca-brava.n, pimenta.n, coração.N, bode.n, erva-mate.n, batata-baroa.n, fermento.n, caranguejo.n, peixe.n, sapoti.n, bucho de carneiro.n, cebola.n, tucupi.n, creme.a, banana.n, jaca.n, peito de frango.n, baleia.n, pão.n, pirarucu.n, caju.n, conteúdo.a, batata.n, quirera.n, mozzarela.n, capivara.n, coco.n, jambu.n, víscera.n, piranha.n, queijo.n, sardinha.n, ovo.n, carne.n, guaraná.n, cupuaçu.n, doce de leite.n, shitake.n, arroz.n, azeite de dendê.n, torresmo.n, boi.n, milho.n, frango.n, quiabo.n, catupiry.n, canela.n, salmão.n, cana.n, filé.n, buriti.n, legume.n, pacu.n",,,"inslag.n, ingrediens.n"
842,Inherent_purpose,"purpose.n, function.n",servir.v,,,,,,
843,Inhibit_motion_scenario,,,,,,,,
844,Inhibit_movement,"confinement.n, lock.v, imprison.v, constraint.n, hold.v, constrain.v, restrict.v, immure.v, shut up.v, detain.v, confine.v, tie.v",,"schließen.v, halten.v, behalten.v, stellen.v, einsperren.v, einschließen.v",,"imobilizar.v, cativar.v, reclusão.n",,,
845,Inspecting,"inspection.n, compost.n, frisk.v, check.v, pat down.v, examination.n, proof-read.v, double-check.v, composting.v, inspect.v, examine.v","analyser.v, analyser.v",,,"checar.v, inspecionar.v, examinar.v, revistar.v, verificado.a, verificar.v, conferir.v","v.تفحص, n.فحص",,"kontrollera.v, inspektion.n, röntgenundersökning.n, kolla.v, opinionsundersökning.n, visitera.v"
846,Installing,"deplete.a, erode.v, installation.n, depletion.n, install.v","installer.v, installation.n",,,,"v.ثبت, n.تثبيت",,
847,Installing,"installation.n, install.v",,,,"instalar.v, instalação.n",,,
848,Installing_resume,", assess.n, assessment.n",réinstaller.v,,,,n.إعادة-تثبيت,,
849,Instance,"serving.n, example.n, instance.n, specimen.n, case.n, as.prep",,"Beispiel.n, Fall.n, Exemplar.n",,"exemplo.n, como.prep",,,"fall.n, falli alla fall:8.n, falli alla fall:3.n, falli detta fall:1.n, prov.n, falli alla fall:6.n, falli vanliga fall:4.n, falli detta fall:3.n, stickprov.n, falli alla fall:4.n, falli så fall:1.n, falli alla fall:7.n, falli så fall:9.n"
850,Institutionalization,"institutionalize.v, hospitalization.n, hospitalize.v, commitment.n, institutionalization.n, commit.v, admit.v, admission.n",,"einweisen.v, einliefern.v, bringen.v",ingerir.v,"admitir.v, internar.v, institucionalizar.v, institucionalização.n, ingerido.a, admissão.n, institucionalizado.a",,,
851,Institutions,"institution.n, institutional.a","école.n, système.n",Institution.n,,instituição.n,,,institution.n
852,Intentional_deception,"deceive.v, put (something) over on (someone).v, deception.n, fool.v, get.v, mislead.v, trick.v",,"irreführen.v, für dumm verkaufen.m, täuschen.v, betrügen.v, belügen.v",,,,,
853,Intentional_traversing,"ford.v, cut.v, ascend.v, climb.v",,"besteigen.v, setzen.v, überqueren.v, durchqueren.v",subir.v,"aceder.v, escalar.v, subir.v, enfiar.v",,,
854,Intentionally_act,"doing.n, step.n, act.n, move.n, agent.n, actor.n, measures.n, deed.n, conduct.v, execute.v, coordination.n, execution.n, action.n, activity.n, age.n, act.v, do.v, engage.v, carry out.v, perform.v","faire.v, intentionnellement.adv, monter.v","treiben.v, springen.v, besorgen.v, tun.v, handeln.v, erledigen.v, operieren.v, gehen.v",,"coordenação.n, gesto.n, perfazer.v, sexo.n, desempenho.n, desferir.v, medir.v, agente.n, conduzir.v, picar.v, ação.n, atividade.n, jejum.n, engajar.v, realizado.a, fase.n, feito.a, agir.v, fazer.v, realizar.v, , promover.v, medição.n, missão.n, aguar.v, desfocar.v, empenhar.v, pivô.n, ato.n, intencional.a, mediação.n, atuar.v, refazer.v, execução.n, obra.n, passo.n, feito.n, empreender.v, perpetrar.v, medida.n, ator.n, atitude.n, executar.v, movimento.n",,,"göra.v, handla.v, agerande.n, aktion.n, agera.v, göragöra intryck.v, göragöra skillnad.v, göragöra om.v, göragöra sig.v, sysselsättning.n, aktivitet.n, sysselsätta.v, handlahandlägga.v, göraha att göra:11.v, vidta.v, göragöra slut.v, göragöra bort siggöra sig.v, göraha att göra:14.v, syssla.v, göragöra det samma.v, göraha att göra:5.v, gärning.n, göraha att göra:3.v, handling.n"
855,Intentionally_affect,"do.v, do what (to/with).v, do something (to/with).v",,"machen.v, gehen.v",,,,,"göra.v, göragöra slut.v"
856,Intentionally_create,"develop.v, synthesis.n, synthesise.v, generate.v, generation.n, abatement.n, mitigate.v, establishment.n, mitigation.n, make.v, productive.a, establish.v, cultivation.n, development.n, set up.v, creation.n, accelerate.v, setup.n, production.n, found.v, abate.v, create.v, intensify.v, produce.v, amplify.v","fonder.v, sortir.v, créer.v, création.n","arbeiten.v, bauen.v, Vater.n, eröffnen.v, aufmachen.v, einrichten.v, nähen.v, erstellen.v, entwickeln.v, drehen.v, gründen.v",,"criar.v, arte.n, fundar.v, ideia.n, produtor.a, autoria.n, fundado.a, ter.v, fazer.v, realizar.v, , produzir.v, ilustração.n, direção.n, dar origem.v, animação.n, criação.n, audiodescrição.n, Inventa.v, armação.n, organizar.v, produção.n, co-produção.n, elaborar.v, configurar.v, estabelecer.v, preparar.v, reinventar.v, coprodução.n, estabelecido.a, compor.v, armar.v","v.أنشأ, n.إنشاء",,"göragöra sig.v, göra.v, bilda.v, skapa.v, inrätta.v, sy.v, rekonstruera.v, göragöra om.v, skapande.n"
857,Interactive_moves,", cross.v, dummy.n, hook.n, stroke.n, grasp.n, kicking.n, grapple.v, crossing.n, counter.n, jab.n, pass.n, drop.v, choking.n, direct.n, one-two.n, grip.v, lob.n, lob.v, uppercut.n, combine.v, return.n, counter attack.v, throw.v, wet pass.n, deflect.v, blow.n, grappling.n, lift off.v, drop.n, counter.v, marking.n, lift.v, fight.v, takedown.n, diversionary attack.n, intercept.v, chip.n, hook punch.n, interception.n, take down.v, parry.n, punch.n, dodge.n, kick.v, knock down.v, knockdown.n, deflection.n, return.v, hold.n, hold.v, overtake.v, attack.n, set.n, hand-off.n, counterpunch.n, rainbow flick.n, clear.n, punchcutting.n, immobilize.v, defence.n, receive.v, steal.n, defend.v, reverse flick-over.n, clinch.n, dribble.n, hit.v, dribbling.n, blow.v, rainbow kick.n, dry pass.n, body feint.n, block.n, drop shot.n, straight.n, parry.v, counterattack.v, block.v, reception.n, wrestle.v, lurk.v, tackle.n, strangulation.n, strangling.n, pitch.v, combination.n, pass.v, dodge.v, pin.v, echelon.n, overlap.v, maul.n, lift up.v, cross punch.n, grab.v, feint.n, kick.n, strike.v, pitch.n, dribble.v, grip.n, counterattack.n, attack.v, brazilian cruzado.n, ruck.n, cross.n, throw.n, block pass.n, immobilization.n, punch.v, passing.n, grab.n, mark.v, grasp.v, cut out.v, swing.n",,,"marcación.n, contratacar.v, pase.n, defender.v, lanzar.v, defensa.n, marcar.v, pared.n, escapar.v, pasar.v, regate.n, contraataque.n, lanzamiento.n, recibir.v, regatear.v","arremesso.n, passagem do bastão.n, driblar.v, golpear.v, roubo de bola.n, imobilizar.v, lob.n, chute.n, cruzamento.n, lançar.v, bloqueio.n, , direto.n, leque.n, toque.n, contra-ataque.n, devolver.v, swing.n, levantamento.n, marcar.v, esquiva.n, uppercut.n, devolução.n, livrar.v, recepção.n, agarramento.n, bater.v, pressionar.v, passe.n, tabelar.v, carretilha.n, queda.n, finta.n, estabilização.n, lutar.v, interceptação.n, estrangulamento.n, deflexão.n, derrubar.v, chapéu.n, gancho.n, clear.n, pontapé.n, defesa.n, imobilização.n, soco.n, bola alta.n, lambreta.n, socar.v, erguer.v, tabela.n, ultrapassar.v, troca.n, jab.n, golpe.n, passe molhado.n, ruck.n, block.n, defender.v, lençol.n, marcação.n, tackle.n, esquivar.v, interceptar.v, levantar.v, contra-atacar.v, cruzar.v, passar.v, maul.n, knockdown.n, clinche.n, passe seco.n, combinar.v, escalão.n, agarrar.v, chutar.v, arremessar.v, drible.n, trocar.v, defletir.v, cruzado.n, drible da vaca.n, toco.n, receber.v, meia-lua.n, tocar.v, ataque.n, block pass.n, atacar.v, passagem.n, parada.n, bloquear.v, lançamento.n, derrubada.n",,,
858,Intercepting,"intercept.v, interception.n",,abfangen.v,,interceptar.v,,,
859,Interior_profile_relation,"outside.prep, in between.prep, in among.prep, within.prep, inside.prep, outside the wire.adv, between.prep, abroad.adv, among.prep, amid.prep, in.prep","à l extérieur de.prep, dans.prep, dehors.adv",,,"dentro de.prep, em meio a.adv, fora.adv, externo.a, externar.v, interno.a, em.prep, dentro.adv, a.prep, entre.prep, dentre.prep, no interior de.prep, no meio de.prep",,,
860,Interrupt_process,"uninterrupted.a, interrupt.v, interruption.n",,"unterbrechen.v, stören.v",,"interromper.v, interrupção.n, interrompido.a",,,avbryta.v
861,Intoxicants,"crack.n, ketamine.n, freebase.n, codeine.n, amphetamine.n, opium.n, hashish.n, drug.n, tobacco.n, alcohol.n, methamphetamine.n, cannabis.n, weed.n, snuff.n, nicotine.n, inhalant.n, coke.n, marijuana.n, mescaline.n, heroin.n, barbiturate.n, acid.n, downer.n, pot.n, grass.n, upper.n, peyote.n, morphine.n, joint.n, cocaine.n, dope.n, ecstasy.n, tranquillizer.n, sedative.n, hallucinogen.n, speed.n, LSD.n, cigarette.n",,"Marihuana.n, Opium.n, Kokain.n",,"água sanitária.n, cigarro.n, cloro.n, cola.n, cocaína.n, bala.n, charuto.n, droga.n, cerveja.n, bombar.v, bebida.n, radiação.n, bebida alcoólica.n, bomba.n, maconha.n, gás.n, gasolina.n, , crack.n, cafeína.n, produto químico.n, cinderela.n, coquetel.n, álcool.n, spray.n, lança-perfume.n, substância psicoativa.n, entorpecente.n, pedras de crack.n, produtos de limpeza.n, energético.n, chumbinho.n, racumin.n, whisky.n, k-othrine.n, sabão.n",,,"narkotika.n, drog.n, snus.n, alkohol.n, cigarett.n, etanol.n, cigarr.n, tobak.n, vodka.n, julöl.n, cigarrett.n, vin.n, knark.n, grogg.n, folköl.n"
862,Intoxication,"sober.a, wasted.a, blasted.a, blotto.a, drunk.a, stoned.a, pissed.a, high.a, under the influence (of).prep, intoxicated.a, tipsy.a, sloshed.a, inebriated.a, trip.n",,,,bêbado.a,,,"nykter.a, hög.a, hög.adv, högi högsta hugg:6.a, fylla.n"
863,Invading,"overrun.v, invasion.n, invade.v, invader.n",,"einfallen.v, Invasion.n",,"invadir.v, invasão.n, ocupação.n",,,invadera.v
864,Invasion_scenario,,,,,,,,
865,Irregular_combatants,"hostile.n, combatant.n, fighter.n, guerrilla.n, belligerent.n, militant.n",,,,combatente.n,,,
866,Isolated_places,"boonies.n, boondocks.n, Bumblefuck.n, out-of-the-way.a, outback.n, off the beaten path.adv, fly-over country.n, middle of nowhere.n, backwater.n, backwoods.n, Podunk.n, godforsaken.a, the sticks.n, back of beyond.n, backcountry.n",,,,,,,
867,Judgment,"admiring.a, scornful.a, value.v, appreciate.v, vilification.n, blame.n, set store.v, reprehensible.a, admiration.n, mockery.n, disdain.v, respect.n, appreciative.a, appreciation.n, disdainful.a, boo.v, scorn.v, damnation.n, disdain.n, disrespect.n, approve.v, stigmatize.v, disapproval.n, disapproving.a, mock.v, stricture.n, approving.a, deplore.v, admire.v, accuse.v, critical.a, contempt.n, respect.v, scorn.n, exalt.v, prize.v, contemptuous.a, fault.n, accolade.n, applaud.v, reverence.n, esteem.n, uncritical.a, esteem.v, derisive.a, revere.v, stigma.n, reproach.n, reproachful.a, exaltation.n, fault.v, deify.v, blame.v, approbation.n, disapprove.v",,,,,,,"popularitet.n, föraktfull.adv"
868,Judgment,"disapprove.v, value.v, scornful.a, admiring.a, appreciate.v, vilification.n, blame.n, set store.v, reprehensible.a, admiration.n, mockery.n, disdain.v, respect.n, appreciative.a, appreciation.n, fault.v, disdainful.a, boo.v, scorn.v, damnation.n, disdain.n, disrespect.n, approve.v, disapproval.n, disapproving.a, mock.v, stricture.n, approving.a, accuse.v, admire.v, deplore.v, critical.a, contempt.n, respect.v, scorn.n, exalt.v, prize.v, contemptuous.a, fault.n, accolade.n, applaud.v, reverence.n, esteem.n, esteem.v, derisive.a, revere.v, stigma.n, reproach.n, reproachful.a, exaltation.n, uncritical.a, deify.v, blame.v, approbation.n, stigmatize.v","stigmatiser.v, valoir.v, valoriser.v",,,"precioso.a, icônico.a, valioso.a, direito.adv, errar.v, honesto.a, apaixonado.a, respeito.n, valorizar.v, admirar.v, respeitar.v, estigmatizar.v, severo.a, impecável.a",,,
869,Judgment_communication,"ridicule.n, laud.v, critique.v, protest.v, mock.v, denunciation.n, kudos.n, blast.v, decry.v, critical.a, criticize.v, condemnation.n, excoriate.v, praise.n, deride.v, disparagement.n, critique.n, critic.n, reprehension.n, denigrate.v, rave.v, commendation.n, blame.v, mocking.a, belittling.n, rip.v, deprecative.a, commendatory.a, acclaim.v, execrative.a, denouncement.n, disparage.v, ridicule.v, execration.n, disparaging.a, deprecate.v, charge.v, commendable.a, maledictory.a, accusation.n, reprehend.v, censure.n, denunciative.a, attack.n, remonstrance.n, denounce.v, criticism.n, harangue.n, laudatory.a, belittlement.n, deprecation.n, denigrative.a, denigration.n, scoff.v, gibe.v, protest.n, extol.v, belittle.v, deprecatory.a, laudable.a, charge.n, acclaim.n, remonstrate.v, accuse.v, commend.v, pin.v, damn.v, tout.v, cite.v, derision.n, hail.v, attack.v, execrate.v, castigate.v, malediction.n, praise.v, recrimination.n, harangue.v, slam.v, denunciatory.a, censure.v, scathing.a, recriminate.v, excoriation.n, condemn.v, dump.v",célébrer.v,,"recriminar.v, censurar.v, abuchear.v, agradecer.v, alabar.v, amonestar.v, reprobar.v, ridiculizar.v, menospreciar.v, acusar.v, elogiar.v, ensalzar.v, despotricar.v, regañar.v, reprender.v, criticar.v, ridiculizar.v\n","crítica.n, censura.n, crítico.a, celebrar.v, , criticar.v",,,"anklaga.v, beröm.n, rekommendera.v, prisa.v, rekommendation.n, lovfå lov:1.n, hån.n, hylla.v, kritik.n, anklagelse.n, kritisera.v, anmärka.v, håna.v, lovtack och lov:1.n, kritikkritiker.n"
870,Judgment_direct_address,"admonishment.n, admonition.n, upbraid.v, thank.v, compliment.n, admonish.v, reprove.v, chide.v, reprimand.v, rebuke.n, reprimand.n, telling off.n, reproof.n, berate.v, scold.v, rebuke.v, reproach.v, congratulate.v, harangue.v, talking-to.n, chastise.v, give shit.v, thanks.n, jeer.n, chastisement.n, castigatory.a, tongue-lashing.n, take to task.v, tell off.v, compliment.v, jeer.v, castigation.n",merci.intj,,,"parabéns.n, , obrigado.a, obrigado.n",,,"komplimang.n, tacka.v"
871,Judgment_of_impact_on_the_environment,", green.a, clean.v, environmental.a","écologique.a, environnemental.v, propre.a, vert.p",,,"ecológico.a, ambiental.a",,,
872,Judgment_of_intensity,"faint.a, lightest.a, severe.a, weak.a, strong.a, severity.n, extreme.a, intense.a, intensity.n","extrême.a, extrême.a, intense.a, intensité.n, violent.n",schwer.a,,"forte.a, vivo.a, proporcional.a, árduo.a, marcadamente.adv, -, grave.a, insuportável.a, gravar.v",,"极端.a, 严重.v",
873,Judicial_body,"court.n, tribunal.n, judiciary.n, judicial.a",,,,"vara.n, , tribunal.n",,,"tribunal.n, juridisk.a, tingsrätt.n, domstol.n, juridisk.adv, länsrätt.n, rättslig.a, kammarrätt.n, hovrätt.n"
874,Jury_deliberation,"deliberate.v, deliberation.n",,"beraten.v, beratschlagen.v",,,,,
875,Just_found_out,"shock.n, shocked.a, surprised.a, surprise.n",frapper.v,"geschockt.a, überrascht.a, Schock.n",,chocado.a,,,
876,Justifying,"defend.v, justify.v, explain.v, account.v, rationalize.v, justification.n",,"entschuldigen.v, begründen.v, verteidigen.v, rechtfertigen.v, erklären.v",,,,,
877,Key,"keycard.n, passcard.n, password.n, combination.n, key.n",,,,chave.n,,,
878,Kidnapping,"kidnap.v, abducted.a, shanghai.v, kidnapper.n, abduct.v, abductor.n, snatcher.n, snatch.v, kidnapped.a, abduction.n, nab.v, kidnapping.n",,,,"sequestrar.v, sequestro.n",,,kidnappa.v
879,Killing,"smother.v, blood-bath.n, butcher.v, genocide.n, fatality.n, murder.n, slayer.n, terminate.v, dispatch.v, suffocation.n, annihilate.v, carnage.n, crucify.v, starve.v, assassinate.v, fratricide.n, pogrom.n, matricide.n, murder.v, massive.a, killer.n, killing.v, patricide.n, fatal.a, killing.n, immolation.n, shooting.n, massacre.n, suffocate.v, assassination.n, take out.v, suicide.v, destroy.v, behead.v, slaughterer.n, lynch.v, slay.v, kill.v, do in.v, liquidation.n, ""take (someones) life.idio"", take (someone's) life.idio, euthanasia.n, silence.v, extermination.n, lethal.a, butchery.n, holocaust.n, garrotte.v, slaughter.n, assassin.n, cause.v, deadly.a, massacre.v, annihilation.n, eliminate.v, decimate.v, liquidator.n, smothering.n, murderer.n, crucifixion.n, liquidate.v, euthanize.v, exterminate.v, slaughter.v, homicide.n, infanticide.n, slaying.n, decapitation.n, beheading.n, suicide.n, bloodshed.n, decapitate.v, drown.v, asphyxiate.v, shoot.v, regicide.n, shooting.v","abattage.n, abattre.a, décimer.v, tuer.v, causer.v, entraîner.v","abschlachten.v, erschlagen.v, in den Tod reißen.m, fordern.v, aufräumen.v, umbringen.v, töten.v, Killer.n, Mord.n, morden.v, Attentäter.n, das Leben nehmen.m, Ermordung.n, schlachten.v, Massaker.n, vernichten.v, ausrotten.v, Mörder.n, Tötung.n, enthaupten.v, verbrennen.v, erwürgen.v, ermorden.v, lynchen.v, zur Strecke bringen.m",,"feminicídio.n, homicidiar.v, suicídio.n, extermínio.n, morto.a, homicidar.v, suicidar.v, matar.v, -, homicídio.n, autoextermínio.n",,,"mörda.v, slakta.v, döda.v, mord.n, begåbegå självmord.v, självmordbegå självmord:3.n, massmord.n, blodbad.n, dråp.n, mördare.n, karaktärsmord.n"
880,Kinship,"name.n, brother.n, relative.n, niece.n, stepsister.n, ancestral.a, cousin.n, son.n, mother.n, daughter.n, ancestor.n, mom.n, kinsman.n, auntie.n, grandson.n, kinswoman.n, forefather.n, nephew.n, dad.n, kin.n, descendant.n, ma.n, grandfather.n, clan.n, great-granddaughter.n, filial.a, forebear.n, mother-in-law.n, stepfather.n, kid.n, family.n, maternal.a, granddaughter.n, offspring.n, daughter-in-law.n, scion.n, stepbrother.n, stepson.n, son-in-law.n, heritage.n, child.n, grandmother.n, aunt.n, brother-in-law.n, father.n, stepmother.n, stepdaughter.n, in-law.n, uncle.n, sister-in-law.n, parent.n, sibling.n, kinsfolk.n, paternal.a, daddy.n, father-in-law.n, kinship.n, people.n, parental.a, great-grandson.n, sister.n","enfant.n, fille.n, fils.n, mère.n, parent.n, père.n",,,"agregado.n, irmão.n, padrasto.n, família.n, familiar.n, marido.n, madrinha.n, avó.n, filhar.v, parental.a, filha.n, parente.n, tio.n, cônjuge.n, , filho.n, neto.n, genitor.n, madrasta.n, sobrinho.n, vó.n, enteado.n, pai.n, papai.n, filho.a, hereditário.n, mãe.n, primo.n, irmã.n, jantar.n, mamãe.n, antepassado.n, avô.n, materno.a",,,"syskon.n, familj.n, mamma.n, pappa.n, förälder.n, broderbror.n, dotter.n, barn.n, flicka.n, syster.n, faster.n, far.n, kusin.n, morfar.n, barnfamilj.n, anhörig.a, storebror.n, mormor.n, pojke.n, mor.n, farbror.n, tvilling.n, son.n, bror.n, syrra.n, barnbarn.n, närstående.a, morbror.n"
881,Knot_creation,tie.v,,binden.v,,,,,
882,Knot_creation_scenario,,,,,,,,
883,Labeling,"label.v, brand.v, term.v, call.v",,,,"rótulo.n, chamar.v, rotular.v",,,
884,Labor_product,"work.n, oeuvre.n, output.n",,Arbeit.n,,"trabalho.n, obra.n",,,"verki själva verket:3.n, verk.n, verki själva verket:13.n, verki själva verket:1.n, verki själva verket:17.n"
885,Language__ability,,,,,"proficiência.n, língua.n, atividade.n",,,
886,Languages,,,,,"inglês.n, gaélico.n, português.n",,,"finska.n, engelska.n, chiffer.n, latin.n, svenska.n, tyska.n, franska.n, estniska.n, kinesiska.n"
887,Launch_process,launch.v,déclencher.v,"beginnen.v, starten.v, eröffnen.v, schalten.v",,lançar.v,,,lansering.n
