id,FrameName,English,French,German,Spanish,Portuguese,Arabic,Chinese,Swedish
375,Communication_response,"answer.n, rejoinder.n, counter.v, come back.v, answer.v, comeback.n, reply.v, acknowledge.v, respond.v, retort.n, response.n, reaction.n, rejoin.v, reply.n, riposte.n, retort.v","réplique.n, répliquer.v, répondre.v","Antwort.n, antworten.v","objeción.n, respuesta.n, objetar.v, responder.v, replicar.v, contestación.n, réplica.n, contestación.n, réplica.n\n, rebatir.v, desmentir.v, contestar.v","retrucar.v, resposta.n, tornar.v, respostar.v, replicar.v, responder.v",,,"svara.v, svar.n, besvara.v"
376,Commutation,"commute.v, commutation.n",,,,,,,
377,Commutative_process,"addition.n, multiply.v, multiplication.n, add.v",,,,,,,"multiplicera.v, addering.n, addera.v"
378,Commutative_statement,"times.n, sum.n, product.n",,Summe.n,,,,,summa.n
379,Comparative_distinctiveness,,,,"distinguir.v\n, diferenciar.v",,,,
380,Compatibility,"consistent.a, calculate.v, go.v, harmony.n, incompatible.a, at variance.a, harmonize.v, fly in the face of.v, agree.v, jibe.v, cohere.v, compatible.a, consonant.a, match.v, incompatibility.n, dovetail.v, conflicting.a, compatibility.n, rhyme.v, calculation.n, congruent.a, clash.v, congruous.a, comport.v, conflict.v, square.v, accord.v, biocompatible.a",compatible.a,"übereinstimmen.v, stimmen.v, Konflikt.n, passen.v, widersprechen.v, zusammenpassen.v, kompatibel.a",,"consistência.n, condizente.a, harmonia.n, condizer.v",n.توافق,,"sitta.v, överensstämmelse.n, förenlig.a, stämma överens:4.adv, matcha.v"
381,Competition,"competitor.n, championship.n, fight.v, rivalry.n, rival.n, compete.v, competition.n, game.n, competitive.a, league.n, face.v, take on.v, player.n, tournament.n, challenge.n, underdog.n, play.v, dispute.n, contest.n, combat.n, dispute.v",concours.n,"spielen.v, kämpfen.v, abgeben.v, bewerben.v, starten.v, streiten.v, Spiel.n, mitfahren.v","juego.n, competitivo.a, contienda.n, combate.n, competencia.n, enfrentar.v, competir.v, contender.v, jugar.v, competición.n, rivalidad.n, disputa.n, desafío.n, disputar.v","liga.n, competição.n, competitivo.a, jogar.v, disputar.v, concorrência.n, competidor.n, combate.n, campeonato.n, competir.v, encarar.v, jogo.n, torneio.n, desafio.n, game.n, disputa.n, rivalidade.n, brigar.v",,,"tävling.n, utmaning.n, match.n, konkurrens.n, spelare.n, kappkomma i kapp:15i kapp:16.n, konkurrent.n, kvartsfinal.n"
382,Complaining,"complaint.n, grumble.v, grouse.v, complain.v, belly-ache.v, whinge.v, bitch.v, whine.v, lament.v, grievance.n, gripe.n, gripe.v, grousing.n, piss and moan.v, moan.v",,,,"reclamação.n, queixar.v, queixa.n",,,klaga.v
383,Completeness,"full.a, completeness.n, complete.a, total.a, incomplete.a",complet.a,"Vollständigkeit.n, vollständig.a, unvollständig.a, abschließen.v",,"completar.v, complementar.v, total.a, totalidade.n, completa.a, completo.a, completamente.adv",,,fulländning.n
384,Compliance,"play by the rules.v, violation.n, obedient.a, obey.v, compliant.a, compliance.n, break.v, breach.v, noncompliance.n, adherence.n, contravention.n, abide (by).v, flout.v, follow.v, comply.v, violate.v, keep.v, transgression.n, honor.v, in accordance.a, circumvent.v, transgress.v, adhere.v, observe.v, conformity.n, conform.v, lawless.a, breach.n, contravene.v, by-pass.v, contrary.a, observant.a, (in/out of) line.n, observance.n, disobey.v",turbulent.a,"sich gehören.v, verletzen.v, beachten.v, halten.v, widersprechen.v, brechen.v, überfahren.v, befolgen.v, entsprechen.v, hören.v, folgen.v",,"contrariar.v, observado.a, respeitar.v, fiel.a, seguir.v, infidelidade.n, obedecer.v, observar.v, mandar.v",,,"motsättning.n, utmana.v, lyda.v"
385,Computer_setup_scenario,", mature.v",,,,,,,
386,Concessive,"in spite of.prep, if.scon, but.c, much as.scon, though.scon, although.scon, while.scon, to be fair.adv, despite.prep, even if.scon, nevertheless.adv, however.adv, even though.scon","en dépit de.prep, mais.c, pourtant.adv",,,"na realidade.c, mas.c, na verdade.c, mesmo.scon, apesar de.c, ainda que.scon, pelo contrário.c, ainda assim.c, salvo.a, no entanto.c, exceção.n",,,"även.adv, dock.adv, ändå.adv, emellertid.adv"
387,Condition_symptom_relation,"result.n, see.v, characterize.v, manifest.v, consequence.n, provoke.v, characteristic.n, mimic.v, show.v, suggest.v, include.v, frequent.a, indicate.v, due to.prep, present.a, cause.v, present.v, relate.v, occur.v, damage.v, result.v, link.v, cause.n, observe.v, uncommon.a, symptom.n, asymptomatic.a, induce.v, manifest.n, contribute.v, lead.v, produce.v, associate.v, symptomatic.a, common.a",,"Ursache.n, zeigen.v",,"apresentar.v, relacionar.v, devido.prep, resultante.n, decorrer.v",,,"symtom.n, symptom.n"
388,Conditional_occurrence,"supposing.scon, provided.scon, if.scon, assuming.scon, in the event.prep, in case.scon, as long as.scon, what if.scon",,wenn.k,si.c,"se.c, condicionado.a",,,
389,Conditional_scenario,,,,,,,,
390,Conduct,"manner.n, demeanor.n, conduct.n, behavior.n, misbehavior.n, deportment.n, act up.v, misbehave.v, act.v, way.n, bearing.n, conduct.v, comportment.n, carry oneself.v, behave.v",,,,"comportamental.a, conduta.n, dançar.v, comportamento.n",,,bete sig.v
391,Configuration_relation,,,,,,,,
392,Confronting_problem,"confront.v, face.v",,"beschäftigen.v, angehen.v, kämpfen.v, ankommen.v, annehmen.v, stehen.v, nehmen.v, konfrontieren.v",,"lidar.v, passar.v, enfrentar.v, encarar.v",,,
393,Congregating,,,,"concurrir.v, agolparse.v, congregarse.v\n, agruparse.v",,,,
394,Connecting,"farm.n, farming.v, agriculture.n, ","accès.n, connecter.v, connexion.n",,,,"n.إتصال, n.إتصل",,
395,Connecting_architecture,"hallway.n, gate.n, stairs.n, escalator.n, step.n, door.n, staircase.n, lift.n, elevator.n, corridor.n, window.n",porte.n,"Tür.n, Gang.n, Fenster.n, Aufzug.n, Treppe.n, Rolltreppe.n",,"porta.n, janela.n, degrau.n, catraca.n",,,"dörrlämna dörren öppen:17.n, dörr.n, trapphus.n, trappa.n, tröskel.n, korridor.n, hiss.n"
396,Connectors,"tack.n, string.n, lace.n, scotch tape.n, adhesive tape.n, bond.n, chain.n, wire.n, shoelace.n, adhesive.n, rope.n, ribbon.n, strap.n, withy.n, trace.n, link.n, peg.n, nut.n, staple.n, bolt.n, nail.n, thread.n, cord.n, tape.n, screw.n, tie.n, connector.n, glue.n",,"Bolzen.n, Seil.n, Bindung.n, Klebstoff.n, Kette.n, Fessel.n, Schraube.n",,"gancho.n, corda.n, fita adesiva.n, luva.n, filamento.n, cabo.n",,,"kabel.n, kedja.n, lina.n, spik.n, klister.n, snöre.n, sträng.n, ståltråd.n, tråd.n"
397,Conquering,"conquer.v, capture.v, overcome.v, fall.v, reduce.v, takeover.n, take.v",,,,"conquistar.v, tomar conta.v, tomar.v",,,"övervinna.v, erövring.n, inta.v"
398,Contact_image_schema,,,,,,,,
399,Contacting,"mail.v, telephone.v, write.v, telex.v, page.v, ring up.v, cable.v, get in touch.v, ring.v, call up.v, call.v, call in.v, telegraph.v, reach.v, fax.v, call.n, contact.n, phone in.v, get through.v, contact.v, phone.v, radio.v, write in.v, e-mail.v",écrire.v,,"telegrafiar.v, llamar.v, telefonear.v, telegrafiar.v\n, llamar.v","contato.n, chamar.v, corresponder.v, ligar.v, contactar.v, contatar.v, telefonar.v",,,"kontakt.n, kontakta.v, nå.v"
400,Container_focused_placing,,,,,,,,
401,Container_focused_removing,,,,,,,,
402,Containers,"cart.n, duffel bag.n, coffer.n, samovar.n, cauldron.n, punch bowl.n, jigger.n, bin.n, bottle.n, reticule.n, pot.n, crate.n, carafe.n, ramekin.n, can.n, envelope.n, rucksack.n, bag.n, wine bottle.n, reservoir.n, hot-water bottle.n, container.n, urn.n, tureen.n, snifter.n, knapsack.n, drawer.n, cooler.n, crucible.n, canteen.n, toilet bowl.n, hamper.n, coffin.n, hopper.n, censer.n, basin.n, haversack.n, cartridge.n, dispenser.n, bucket.n, jug.n, goblet.n, flagon.n, tun.n, tin.n, valise.n, ashtray.n, cup.n, suitcase.n, canister.n, vase.n, chest.n, tank.n, handbag.n, pot [cooking].n, bowl.n, casserole.n, casket.n, pouch.n, planter.n, dish.n, jeroboam.n, ampule.n, carton.n, carryall.n, pipette.n, purse.n, cuspidor.n, basket.n, empty.n, locker.n, mailer.n, vivarium.n, chest of drawers.n, spoon.n, amphora.n, goldfish bowl.a, decanter.n, briefcase.n, tumbler.n, keg.n, thermos.n, magnum.n, box.n, wallet.n, overnighter.n, satchel.n, glass.n, creamer.n, vial.n, chalice.n, case.n, backpack.n, pannier.n, crock.n, salver.n, capsule.n, barrel.n, vat.n, spittoon.n, pack.n, flask.n, teaspoon.n, sarcophagus.n, flowerpot.n, drum.n, safe.n, tub.n, mug.n, pail.n, sack.n, cruet.n, stein.n, cylinder.n, folder.n, cask.n, beaker.n, ladle.n, jar.n, etui.n, grail.n",boîte.n,,,"copar.v, buraco.n, saco.n, chopeira.n, sacola.n, frasco.n, embalagem.n, cumbuca.n, taça.n, cesto.n, garrafa.n, vidro.n, com.adv, furo.n, travessa.n, vaso.n, bisnaga.n, compartimento.n, tubo.n, caixa.n, carteira.n, copo.n, pote.n, gaiola.n, cesta.n, poço.n, recipiente.n, cano.n, pá.n",,,"behållare.n, flaska.n, verktygslåda.n, burk.n, väska.n, vinflaska.n, påse.n, glas.n, vattenflaska.n, kärl.n, magasin.n, skål.n, askfat.n, handväska.n, plånbok.n, pool.n, kista.n, glasburk.n, box.n, vattenglas.n, låda.n, bunke.n"
403,Containing,"contain.v, house.v, hold.v, store.v",,"stecken (in).v, enthalten.v","contener.v, contener.v\n","conteúdo.a, conter.v, alojar.v, ter.v",,,innehålla.v
404,Containment,,,,,,,,
405,Containment_relation_IS,,,,,,,,
406,Containment_scenario,,,,,,,,
407,Contamination,", acidify.v, acidification.n, contaminate.v, pollute.v, eutrophication.n, salinization.n","acidification.n, acidifier.n, chloration.n, contamination.n, contaminer.v, eutrophisation.n, eutrophiser.v, polluer.v, pollution.n, salinisation.n",,,poluir.v,,,
408,Contingency,"dependence.n, dictate.v, turn.v, dependent.a, depend.v, factor.n, depends.v, determine.v, independent.a, hinge.v, hang (on).v, variable.n, independence.n, function.n",,,,"depender.v, independente.a, da.adv, dependência.n, de.adv, do.c, dar.v",,,faktor.n
409,Continued_state_of_affairs,"to date.adv, as of yet.adv, up to.prep, still.adv, so far.adv, as yet.adv",toujours.adv,,,,,,"ännu.adv, fortfarande.adv, änän så länge.adv, än.adv"
410,Contrary_circumstances,"in spite of.prep, in face of.prep, despite.prep, amidst.prep, in the face of.prep",,,"a, pesar, de.prep","mesmo que.scon, apesar de.adv",,,
411,Contrition,"sorry.a, contrition.n, remorseful.a, unrepentant.a, penitence.n, contrite.a, rue.v, penitent.a, remorse.n, repent.v, guilty.a, remorseless.a, apologize.V, repentance.n, repentant.a, rueful.a, guilt.n",,"bedauern.v, leidtun.v",,"contrição.n, arrepender-se.v, impenitente.a, remorso.a, penitente.a, arrependimento.n, desculpa.n, desculpar.v, arrependido.a, penitência.n, culpa.n, penalizado.a, arrepender.v, contrito.a, remorso.n, culpado.a",,,ångerfull.a
412,Control,"regulation.n, regulate.v, control.v, determine.v, command.v, sequester.n, command.n, sequestration.n, control.n, capture.n",,"regeln.v, bestimmen.v",,"regulamentação.n, travar.v, regulamento.n, regulamentar.v, determinar.v, condicionar.v, travamento.n","v.تحكم, تحكم, n.",,"insyn.n, kontroll.n"
413,Controller_object,"knob.n, switch.n, button.n, switchboard.n, control.n, board.n",,,,,,,knapp.n
414,Converting,"convert.v, transform.v, , conversion.n, hybridization.v","conversion.n, conversion.n, convertir.v, hybridation.n, transformation.n, transformer.v",,,,,,
415,Convey_importance,"underline.v, stress.v, underscore.v, emphasize.v",,,"enfatizar.v, , hacer_hincapié.v, enfatizar.v, recalcar.v, poner_de_relieve.v, subrayar.v, subrayar.v\n",,,,poängtera.v
416,Convoy,"convoy.n, train.n",,Konvoi.n,,,,,
417,Cooking_creation,"roast.v, cook.n, preparation.n, put together.v, make.v, baking.n, grilling.n, fix.v, concoct.v, cook up.v, whip up.v, prepare.v, fry.v, cooking.n, grill.v, bake.v, frying.n, roasting.n, cook.v",cuisiner.v,"machen.v, kochen.v, geben.v, vorbereiten.v, braten.v, backen.v, anmachen.v",,"colocar.v, inventar.v, parmegiana.a, assar.v, triturar.v, frito.a, fermentado.a, mexer.v, gratinar.v, decorar.v, adicionar.v, polvilhar.v, grelhar.v, triturado.a, bater.v, degustação.n, fritar.v, culinário.a, feito.a, fazer.v, cru.a, despejar.v, fermentar.v, culinária.n, fritura.n, temperar.v, picado.a, salgar.v, milanesa.a, deixar.v, moído.a, apimentar.v, consertar.v, dourar.v, preparação.n, cozinheiro.n, preparar.v, reinventar.v, piamontese.a, acrescentar.v, cozinhar.v, assado.n",,,"baka.v, tillagning.n, tillreda.v, lagalaga mat.v, laga.v"
418,Corporal_punishment,"caning.n, cane.v, scourge.v, flogging.n, paddle.v, flog.v, spank.v, lash.n",,auspeitschen.v,,,,,"hudflängning.n, piska.v"
419,Correctness,"correct.a, wrong.a, TRUE.a, true.a, incorrect.a, exact.a, right.a, correctness.n, accurate.a","avoir tort.v, erroné.a, faux.a, même.adv, raison.n, vrai.a","stimmen.v, korrekt.a, falsch.a, richtig.a, Richtigkeit.n",,"preciso.a, errar.v, correto.a, direito.a, equivocado.a, certo.a, verdade.n, corrigir.v, engano.n, exato.a, mesmo.adv",,,"rätt.a, rätt.adv, korrekt.a, felfri.a, korrekt.adv, rättha rätt:1.a, sanningsenlig.a"
420,Corroding,"oxidize.v, corrode.v, rust.v",,"verrosten.v, korrodieren.v",,,,,
421,Corroding_caused,"oxidize.v, tarnish.v, corrode.v, rust.v",,,,,,,
422,Cotheme,"shepherd.v, stalk.v, guide.v, show.v, lead the way.v, guided.a, shadow.v, escort.v, usher.v, conduct.v, follow.v, tail.v, dog (someone's) steps.idio, dog.v, track.v, accompany.v, trail.v, tag along.v, chase.v, pursuer.n, hound.v, pursuit.n, lead.v, ""dog (someones) steps.idio"", walk.v, pursue.v",accompagner.v,"hinterherjagen.v, bringen.v, leiten.v, mitfahren.v, verfolgen.v, nachjagen.v, begleiten.v, führen.v, jagen.v, folgen.v","escoltar.v, perseguir.v, conducir.v, acompañar.v, persecución.n, traer.v, llevar.v, pasear.v, acompañar.v, traerse.v\n, llevarse.v, acorralar.v, traerse.v","perseguição.n, conduzir.v, guiar.v, seguir.v",,,"leda.v, åtfölja.v, förfölja.v, eskortering.n, leleda.v, spåra.v, beledsaga.v"
423,Counterattack,"counter-attack.v, counter-offensive.n, counter-attack.n",,"angreifen.v, Angriff.n, Offensive.n",,"contra-atacar.v, contra-ataque.n",,,
424,Course,,,,,"magistério.n, mestrado.n, licenciatura.n, curso.n, doutorado.n, bacharelado.n",,,
425,Court_examination,"cross.n, examine.v, examination.n, cross-examine.v, cross-examination.n",,,,,,,
426,Covering_area_with_trees,", reforest.n, afforest.a, reforestation.n, afforestation.n","boisement.a, boiser.v, reboisement.v, reboiser.v",,,"florestamento.n, reflorestar.v, reflorestamento.n",,,
427,Covering_locale,"atmosphere.n, , biosphere.a, cryosphere.n, ozone.n","atmosphère.n, biosphère.n, couche.n",,,atmosfera.a,,大气层.n,
428,Craft,"science.n, cosine.n, craft.n, art.n",,"Kunst.n, Handwerk.n",,"crochê.n, pescaria.n, arte.n, pseudociência.n, ciência.n, ofício.n",,,
429,Create_physical_artwork,"cast.v, take [picture].v, sculpt.v, draw.v, artist.n, paint.v","dessin.n, dessiner.v, faire.v, peindre.v, peinture.n","malen.v, zeichnen.v, sprühen.v",,"tirar foto.v, desenhar.v, esculpir.v, plástica.a, pintado.a, artista.n, escalar.v, pintar.v",,,"målning.n, rita.v, teckna.v"
430,Create_representation,"cast.v, photograph.v, carve.v, draw.v, get.v, paint.v, sketch.v",,"malen.v, schneiden.v, fotografieren.v, zeichnen.v",foto.n,"xilogravura.n, tirar foto.v, esculpir.v, desenhar.v, esboçar.v, ilustrado.a, foto.n, fotografar.v, pintar.v, retratar.v, fotografia.n",,,"avbilda.v, porträttera.v, fotografera.v, filma.v"
431,Creating,"issuance.n, productivity.n, create.v, formation.n, issue.v, produce.v, generate.v, make.v, form.v, assemble.v, come about.v, yield.v, production.n","modeler.v, produire.v","treten.v, bauen.v, gestalten.v, ausstellen.v, machen.v, produzieren.v, bilden.v, erschaffen.v, in die Welt setzen.m, zusammenbauen.v",,"criar.v, consistir.v, formar.v, inovação.n, instituir.v, conceber.v, formação.n, criador.n, inovar.v, produzir.v, produção.n",,,utfärda.v
432,Crime,", crime.n","crime.n, offense.n",,crimen.n,crime.n,,,
433,Crime_scenario,,,,,,,,
434,Criminal_investigation,"probe.n, probe.v, inquiry.n, investigate.v, inquire.v, lead.n, clue.n, case.n, investigation.n",,,,,,,ledtråd.n
435,Criminal_process,,,,,,,,
436,Crowd,", spectator.n, outlet.n, television viewer.n, onlooker.n, crowd.n, supporter.n, audience.n, fan.n",,,"hincha.n, telespectador.n, aficionado.n, fan.n, espectador.n, audiencia.n, hinchada.n","torcedor.n, telespectador.n, plateia.n, torcida.n, fã.n, espectador.n",,,
437,Crowd_reactions,"celebration.n, cry.v, see.v, watch.v, thrill.v, frustration.n, , cheer.v, applaud.v, look.v, roar.v, shout.v, support.v, explode.v, awake.v, celebrate.v, boo.v",,,"celebración.n, animar.v, abuchear.v, asistir.v, celebrar.v, fustración.n, mirar.v, despertar.v, ver.v, aplaudir.v, gritar.v, ovacionar.v, explotar.v, apoyar.v, llorar.v, vibrar.v, observar.v","vaiar.v, assistir.v, chorar.v, comemorar.v, comemoração.n, torcer.v, despertar.v, ver.v, gritar.v, ovacionar.v, explodir.v, apoiar.v, vibrar.v, observar.v, frustração.n, aplaudir.v",,,
438,Cure,"rehabilitation.n, alleviation.n, cure.v, healer.n, rehabilitate.v, remedy.n, curative.a, ease.v, nurse.v, incurable.a, curable.a, palliate.v, treat.v, therapy.n, therapist.n, alleviate.v, treatment.n, palliative.a, palliative.n, rehabilitative.a, heal.v, resuscitate.v, remedy.v, curative.n, cure.n, palliation.n, therapeutic.a","chirurgical.a, opération.n","bekommen.v, behandeln.v, helfen.v, verbinden.v, operieren.v",,"alta médica.n, planejado.a, restauração.n, melhorar.v, terapia.n, alta.n, toxicidade.n, terapêutico.a, alta hospitalar.n, curar.v, curativo.a, resolução.n, antígeno.n, planejar.v, imune.a, melhora.n, bem.a, tratamento.n",,,
439,Custom,"ethnic.a, meditation.n, ways.n, use to.v, sacred.a, tradition.n, traditionally.adv, religious.a, ritualistic.a, religiously.adv, holy.a, usual.a, ritual.n, islamic.a, traditional.a, convention.n, habit.n, customary.a, practice.n, religion.n, christian.a, custom.n, habitual.a",,,,"clássico.a, tradição.n, esgrima.n, rotina.n, costumar.v, habitualmente.adv, cultura.n, paradigma.n, costume.n, acostumar.v, tradicional.a",,,"vana.n, tradition.n, traditionell.adv, traditionell.a, sedvanlig.a, sed.n, bruklig.a, stridsvana.n"
440,Cutting,"mince.v, slice.v, carve.v, cube.v, pare.v, cut.v, fillet.v, dice.v, chop.v",,schneiden.v,,"picado.a, corte.n, faca.n, picadinha.a, cortar.v, cisar.v, tosa.n",,,"strimla.v, tärning.n, klippa.v, skäraskära halsen.v, skäraskära av.v, såga.v, hacka.v, skära.v, skäraskära sig.v, klippande.n, karva.v"
441,Cutting_trees,", cut.v","abattage.n, abattre.a, coupe.n",,,,,,
442,Cycle_of_existence_scenario,,,,,,,,
443,Cycle_of_life_and_death,,,,,,,,
444,Damaging,"scratch.v, nick.v, dent.v, rip.v, degradation.n, deface.v, mar.v, sabotage.v, key.v, chip.v, rend.v, damage.v, score.v, scrape.v, vandalise.v, tear.v, vandalism.n, damage.n, degrade.p","dégradation.n, dégrader.v, détérioration.n, détériorer.v, endommager.v","treten.v, verunstalten.v, eindellen.v, aufreißen.v, zerreißen.v, kaputtmachen.v, fressen.v, brennen.v, einschlagen.v, schaden.v, beschädigen.v, verletzen.v",,"arrebentar.v, trincar.v, degradar.v, danificar.v, dano.a, vandalizar.v, pichação.n, rasgar.v, furar.v, degradação.n",,,"skada.v, härja.v, skadegörelse.n, härjning.n, vandalisering.n"
445,Danger,,,", riskant.a, gefährdet.a, die.n, wagen.v, hüten.v, Drohung, bedrohen.v, Sicherheit, schützen.v, das.n, unsicher.a, Gefahr, drohen.v, riskieren.v, anfällig.a, gefährden.v, bedroht.a, retten.v, sicher.a, Schutz, gefährlich.a, Bedrohung, Risiko, wagen: sich wagen.v, der.n, geschützt.a",,,,,
446,Daring,"dare.v, audacity.n, risk.v, risk.n, venture.v, audacious.a, hazard.v, audaciousness.n, chance.n, chance.v","audacieux.a, audacieux.a, oser.v, oser.v",,"atreverse.v, osar.v, osar.v\n, arriesgarse.v, aventurarse.v, arriesgarse.v",,,,
447,Data_flow,", cold.a, temperature.n, warm.a, cool.a",circuler.v,,,,,,
448,Dead_or_alive,"lifeless.a, living.a, dead.a, alive.a, late.a, mortal.a, dead.n, life.n, dirt nap.n, living.n, undead.n, nonliving.a, live.v, undead.a, living.v, deceased.a","vie.n, vivre.v, mort.n, vivant.v, en.a",,,"vivo.a, mortal.n, -, mortal.a, vida.n",,,"liv.n, livi livet:7.n, livlivs.n, livta sitt liv:11.n, leva.v, livlivstill livs:17.n"
449,Death,"decease.v, perish.v, mortal.a, mortality.n, suffocate.v, expire.v, kick the bucket.v, death.n, end.n, suffocation.n, starve.v, demise.n, croak.v, croak it.v, starvation.n, terminator.n, pass away.v, drown.v, die.v, asphyxiate.v",mortalité.n,,,"afogamento.n, morrer.v, perda.n, -, morte.n",,,"dödtill döds:19.n, dödö bort.v, tidgå ur tiden:15.n, död.a, dödtill döds:4.n, avlida.v, dö.v, död.n, omkomma.v, drunkna.v, stupa.v, tidgå ur tiden:18.n"
450,Deception_end,,,,,,,,
451,Deception_scenario,,,,,,,,
452,Deception_success,"deceit.n, deception.n",,,,,,,
453,Deciding,"rule out.v, decision.n, decide.v, determine.v",déterminé.a,", Entscheidung: eine Entscheidung treffen.m, feststellen.v, beschließen.v, wählen.v, die.n, entscheiden: sich entscheiden.v, aussuchen: (sich) etwas aussuchen.v, Entscheidung, entschließen: sich entschließen.v, Auswahl, Wahl",,"decisiva.a, estabelecer.v, combinar.v, decidir.v, resolver.v, decisão.n",,,"beslutabesluta sig.v, sättasitta uppsätta upp.v, besluta.v, sätta.v, sättasätta i sigsätta sig.v, sättasitta ner.v, sättasätta sig.v, avgöra.v, diagnostisera.v, sättasätta på prov.v, bestämma.v, sättasätta igång.v, beslut.n, sättasätta upp.v, sättasätta sigsätta sig uppsätta upp.v, sättasätta eld.v, sättasätta ihop.v, diagnos.n, sättasätta in.v"
454,Decontamination,", decontamination.n, decontaminate.v","assainir.v, assainissement.n, décontamination.n, décontaminer.v, dépolluer.v, épuration.n, épurer.v, purifier.n",,,,,,
455,Defending,"defend.v, defensive.a, defense.n, defender.n, biodefense.n, hold.v, defenses.n",,"verteidigen.v, vertreten.v, halten (zu).v",,,,,"försvar.n, försvara.v"
456,Degree,"too.adv, perfectly.adv, in part.adv, as hell.adv, pretty.a, closely.adv, very.adv, rather.adv, slightly.adv, crystal (clear).n, totally.adv, purely.adv, hardly.adv, somewhat.adv, completely.adv, so.adv, really.adv, a little bit.adv, fully.adv, a lot.adv, less.adv, stone (cold).n, dirt (poor).n, heavily.adv, super.a, almost.prep, a little.adv, particular.a, more.adv, most.n, quite.adv, kind of.adv, great.a, partially.adv, that.adv, way.adv, absolutely.adv, far.adv, partly.adv, profoundly.adv, sopping (wet).a","ardemment.adv, beaucoup.adv, en partie.adv, intime.a, le plus.adv, meilleur.a, most.adv, particulier.a, profondément.adv, que.adv, radicalement.adv, très.adv, vraiment.adv","sehr.a, so.a, total.a","grande.a, , más.adv","em parte.adv, extremamente.adv, enorme.a, todo.adv, deveras.adv, absolutamente.adv, ligeiramente.adv, ainda.adv, extremo.a, tão.adv, grande.a, meio.adv, mesmo.adv, tanto.adv, superdimensionado.a, quase.adv, super.adv, absurdo.a, infinitamente.adv, realmente.adv, radical.a, bem.adv, menos.adv, hiper.adv, mais ou menos.adv, pesado.a, estupidamente.adv, pouquinho.adv, totalmente.adv, melhor.adv, muito.adv, mais.adv, belo.a",,,"verkligen.adv, mermycket.adv, mycket.adv, väldig.adv, lite.adv, total.adv, god.a, meramycket.adv, rätt.adv, ganska.adv, fögalitelitenmer eller mindre:31.adv, fögaliteliten.adv, fögalitelitenminst.adv, litenlitet.adv, extrem.adv, fögalitelitenmer eller mindre:2.adv, extrem.a, god.adv, mestadels.adv, godför gott:6.adv, väldig.a, mermycketvarken mer eller mindre:8mer eller mindre.adv, fögalitelitenvarken mer eller mindre:8mer eller mindre:9.adv, meramycketmed mera:17.adv, fullständig.a, litepå lite längre sikt:15.adv, jätte.adv"
457,Degree_of_processing,"processed.a, raw.a, enriched.a, unprocessed.a, pre-rolled.a",,,,,,,
458,Delegation,", commission.n, confederation.n, delegation.n",club.n,,"confederación.n, , delegación.n","delegação.n, confederação.n",,,
459,Delimitation_of_diversity,"range.v, from to.idio",,liegen.v,,,,,
460,Delimited_state_scenario,,,,,,,,
461,Delivery,"delivery.n, deliver.v",,,,"entregar.v, entrega.n, distribuição.n, entregue.a",,,"leverans.n, leverera.v"
462,Deny_or_grant_permission,"mandate.n, the green light.n, leave.n, prohibition.n, authorize.v, sanction [allow].v, approve.v, suffer.v, prohibit.v, allowed.a, clear.v, greenlight.v, outlaw.v, permission.n, disallow.v, restrict.v, permit.v, okay.v, approval.n, the okay.n, forbid.v, the go ahead.n, the go-ahead.n","autorisation.n, écarter.v, pouvoir.v",,,"aprovado.a, aprovar.v",,,
463,Departing,"vamoose.v, emerge.v, escape.v, disappearance.n, escape.n, exit.n, vanish.v, skedaddle.v, departure.n, depart.v, exodus.n, disappear.v, come out.v, leave.v, exit.v, decamp.v","aller.v, aller.v, partir.v, quitter.v, quitter.v, s en aller.v, s en aller.v, sortir.v, sortir.v","aufbrechen.v, losfahren.v, verlassen.v, abfliegen.v, starten.v, weggehen.v, zurückziehen.v, abfahren.v, ausziehen.v, fliehen.v, wegfahren.v, Abreise.n, kommen.v, gehen.v, abflogen.v","exiliarse.v, salir.v, desertar.v, alejarse.v, repliegue.n, largarse.v, retirada.n, alejarse.v, emigrar.v, retirarse.v, marcharse.v","desaparecer.v, deixar.v, desaparecimento.n, afastar.v, exôdo.n, fuga.n, sair.v, ir.v, escapar.v, extravio.n, emergir.v, partir.v, debandar.v, despedir.v, sumir.v, despedida.n, saída.n, ir embora.v",,,"lämna.v, lämnalämna dörren öppen.v, lämnalämna efter sig.v, avgå.v, lämnalämna in.v, lämnalämna kvar.v"
