id,FrameName,English,French,German,Spanish,Portuguese,Arabic,Chinese,Swedish
1 125,Political_locales,", village.n, country.n, metropolitan city.n, city municipality.n, earth.n, province.n, realm.n, state.n, municipality.n, ""nations capital.n"", barrio.n, fiefdom.n, locality.n, favela.n, barony.n, internationally.adv, world.n, local.a, town.n, government.n, district.n, capital.n, provincial.a, kingdom.n, principality.n, city.n, parish.n, borough.n, territorial division.n, international.a, municipal.a, duchy.n, block.n, ground.n, viscountcy.n, commonwealth.n, city employment.n, diocese.n, multinational.a, metropolis.n, township.n, territory.n, hamlet.n, neighborhood.n, city-state.n, state [internal].n, urban center.n, federal.a, nation.n, provincial capital.n, national.a, state [sovereign].n, global.a, land.n, megalopolis.n, kampung.n, archdiocese.n, county.n, territorial.a, jurisdiction.n, dominion.n, empire.n","national.a, pays.n",,"nacional.a, provincia.n, capital.n, imperio.n, ciudad.n, metrópoli.n, favela.n, internacionalmente.adv, distrito.n, gobierno.n, país.n, archidiócesis.n, arraial.n, mundo.n, ducado.n, jurisdición.n, nación.n, internacional.a, comunidad.n, principado.n, pueblo.n, reino.n, parroquia.n, estado.n, tierra.n, aldea.n, diócesis.n, dominio.n, barrio.n, villa.n, municipal.a, feudo.n, municipio.n","capital.n, povoado.n, taba.n, bairro.n, cidade.n, município.n, europa.n, império.n, aldeia.n, vila.n, centro.n, congresso.n, favela.n, mundialmente.adv, planalto.n, internacionalmente.adv, distrito.n, exterior.n, país.n, terra.n, arquidiocese.n, mundo.n, nação.n, principado.n, governo.n, metrópole.n, estado.n, diocese.n, municipal.a, paróquia.n, vilarejo.n, continente.n",,,"värld.n, kommun.n, stad.n, land.n, kvarter.n, stat.n, delstat.n, medlemsstat.n, global.a, kärnvapenmakt.n, landland och rike runt.n, landsbygd.n, lokal.a, by.n, storstad.n, nation.n, rättsstat.n, territorium.n, tätort.n, koloni.n"
1 126,Popularity,"hot.a, in demand.a, in.a, cool.a, popular.a",,"in.a, cool.a, beliebt.a, in aller Munde.m",,"popularizar.v, legal.a, quente.n, popular.a, maneiro.a",,,"populär.a, folklig.a"
1 127,Posing_as,"pose.v, impersonation.n, impostor.n, masquerade.v, impersonate.v",,"ausgeben.v, tarnen.v, posieren.v, darstellen.v",,impostor.n,,,
1 128,Position_on_a_scale,"deficient.a, poor.a, lacking.a, high.a, moderate.a, medium.a, advanced.a, through the roof.adv, low.a, rich.a",richesse.n,,,riqueza.n,,,"hög.adv, näringsfattig.a"
1 129,Possession,"own.v, of.prep, got.v, get.v, wanting.a, have got.v, assets.n, lack.n, effects.n, want.v, property.n, count.v, possessor.n, have.v, ownership.n, want.n, belongings.n, possess.v, lacking.a, owner.n, belong.v, possession [definite noun].n, lack.v, own.pron, custody.n, possession [of goods].n, possession.n",avoir.v,"gehören.v, Besitztum.n, besitzen.v, halten.v, fehlen.v, laufen.v, haben.v","contar.v, de.prep, nan","possessão.n, próprio.a, patentear.v, apresentar.v, proprietário.n, querer.v, ter.aux, contar.v, propriedade.n, ficar.v, colecionar.v, fruir.v, tevê.n, falta.n, ter.v, desejo.n, , custódia.n, dono.n, patenteado.a, possuir.v, manter.v, falto.n, faltar.v, pertencer.v, insuficiente.a, de.prep, deter.v, obter.n, bem.n, têm.v, posse.n, pertences.n, conter.v, produto.n",,,"ha.v, äga.v, brist.n, tillgång.n, haha rätt.v, tillhöra.v, haha ögonen.v, sakna.v, innehav.n, inneha.v, besittningta i besittning:6i besittning:8.n, haha att göra.v, haha råd.v, haha för sig.v, haha sitt.v, haha kvar.v, haha för avsikt.v, tillgångtillgångar.n, ägaäga rum.v, besittningta i besittning:18i besittning:19.n"
1 130,Possibility,"could.v, can.v, may.v, might.v",,,poder.v,"dever.n, devir.v, poder.v, dar para.v, provavelmente.adv, poder.a, dever.v",,,"kunna.v, möjlighet.n"
1 131,Post_getting,,,,,,,,
1 132,Post_giving,,,,,,,,
1 133,Post_lose_possession,,,,,,,,
1 134,Post_receiving,,,,,,,,
1 135,Post_transfer,,,,,,,,
1 136,Posture,", sit.v, bent.a, sprawl.v, slouched.a, slouch.v, lie.v, crouched.a, shrink.v, stance.n, huddle.v, cower.v, hunched.a, kneel.v, sprawled.a, hunch.v, squat.v, bend.v, lay back.v, crouch.v, stand.v, stoop.v, lean.v, posture.n, huddled.a, seated.a, position.n","assis.a, assis.a, debout.a, debout.a, s asseoir.v, s asseoir.v",,,"sentado.a, posar.v, deitado.a, de pé.idio, sentar.v, pose.n, ajoelhado.a",,,"ligga.v, stå.v, sitta.v, på huk:8.n, sittasitta fast.v, ståstå ut.v, ställningta ställning:7.n, ståstå sig.v, sittasätta kurs.v, sittasitta inne.v, ställning.n, liggaligga i bakhåll.v, liggaligga nere.v"
1 137,Practice,"dry run.n, practice.n, run (through).v, rehearsal.n, training.n, mock.a, run-through.n, practitioner.n, practice.v, practice [mass].n, rehearsal [mass].n, rehearse.v, exercise.n, drill.n",,"trainieren.v, probieren.v",,"prática.n, praticar.v, treino.n, treinamento.n, praticante.n, treinar.v",,,"praktiki praktiken:1.n, öva.v, repa.v, träna.v, praktiki praktiken:3.n, praktiki praktiken:15.n, praktiki praktiken:11.n, praktiki praktiken:14.n, träning.n"
1 138,Praiseworthiness,"detestable.a, admirable.a, abominable.a, laudable.a, despicable.a, honorable.a, estimable.a, commendable.a, reprehensible.a, creditable.a, execrable.a, blameworthy.a, meritorious.a, dishonorable.a, pitiable.a, praiseworthy.a, deplorable.a, lamentable.a",,,,"irrepreensível.a, honra.n, louvável.a, admirável.a, deplorável.a, repreensível.a",,,"usel.a, förnäm.a"
1 139,Prank,"prank.n, practical joke.n",,,,,,,"practical joke.n, practical joke:16.n"
1 140,Pre_getting,,,,,,,,
1 141,Pre_giving,,,,,,,,
1 142,Pre_lose_possession,,,,,,,,
1 143,Pre_receiving,,,,,,,,
1 144,Pre_transfer,,,,,,,,
1 145,Precariousness,"instability.n, stability.n, stable.a, balanced.a, teeter.v, steady.a, unsteady.a, unstable.a",,"taumeln.v, halten.v",,"equilibrado.a, desequilíbrio.n, equilibrar.v, desequilibrado.a, equilíbrio.n",,,
1 146,Precipitation,"torrential.a, drizzle.n, snow.v, sleet.n, torrent.n, sleet.v, shower.n, rain.n, snow.n, precipitation.n, rain.v, hail.v, snow [event].n, shower.v, rain event.n, rainfall.n, drizzle.v, precipitation [event].n, sprinkle.v, downpour.n, snowfall.n, hail.n","mousson.n, pluie.a, précipitations.n","schneien.v, regnen.v","lluviaentity.n, caer_chuzos_de_punta.v, nevadaevent.n, nevadaentity.n, nevada_event.n, lluvia_entity.n, nevada_entity.n, llover.v, llover_a_cántaros.v, granizar.v, lloviznar.v, lluviaevent.n, nevar.v, ], nevar.v\n, [, lluvia_event.n, """", -","chover.v, chuva.n, -, garoar.v, neve.n, nevar.v, cair.v, saraivar.v",,"降水.n, 降雨.v","snö.n, regn.n, ösregn.n, duggregn.n, snöa.v, hagelskur.n, regna.v"
1 147,Predicament,"bind.n, issue.n, , misfortune.n, plight.n, pinch.n, fix.n, upside-down.a, problem.n, mess.n, pickle.n, predicament.n, trouble.n, scrape.n, jam.n","problème.n, souffrir.v",,,"prejuízo.n, mazelas.n, distúrbio.n, problema.n",,,"jobbig.a, jobbig.adv"
1 148,Predicting,"claim.v, projection.n, predict.v, soothsay.v, project.n, prognosticate.v, prediction.n, vaticinate.v, foretell.v, prophesy.v, prophecy.n, forecast.v","prédire.a, prévision.n, prévoir.v, prévoir.v, projeter.v",,"prever.v, augurio.n, pronosticar.v, [, """", ], predicción.n, -, presagiar.v, predecir.v, presagio.n, vaticinio.n\n, profecía.n, vaticinar.v, profetizar.v, augurar.v, pronóstico.v, previsión.n",,,"预估.v, 预估.v, 预测.v",
1 149,Predicting,"claim.v, soothsay.v, predict.v, prognosticate.v, prediction.n, vaticinate.v, foretell.v, prophesy.v, prophecy.n, forecast.v",,,"pronosticar.v, predicción.n, predecir.v, profecía.n, vaticinar.v, profetizar.v, prever.v, pronóstico.v, previsión.n","prever.v, previsão.n, profecia.n, predizer.v",,,
1 150,Predicting_scenario,,,,,,,,
1 151,Preference,"favor.v, disprefer.v, would rather (than).v, prefer.v",préférer.v,"gehen über.v, vorziehen.v, halten.v",,"preferir.v, preterir.v, preferência.n",,,
1 152,Preferred_alternative_scenario,,,,,"favorito.a, preferido.a",,,
1 153,Preliminaries,"preliminary.n, exploratory.a, preliminary.a, groundwork.n, training camp.n, prefatory.a, preparatory.a",,"vorläufig.a, Grundlage.n",concentración.n,"concentração.n, concentrar.v, aclimatar.v, aclimatação.n",,,preliminär.a
1 154,Preliminary_stage,", round robin.n, group.n, spot.n, book place.v, qualification.n, qualifying matches.n, qualifying tournament.n, group phase.n, group stage.n, place.n",,,"grupo.n, de, plaza.v, grupos.n, fase, asegurar","eliminatórias.n, grupo.n, conquistar vaga.v, fase de grupos.n, preliminares.n, classificação.n, fase preliminar.n, vaga.n, fase classificatória.n",,,
1 155,Preparing_for_reuse,", recycle.n, recycling.v","recyclage.n, recycler.v",,,,,,
1 156,Preparing_soil,"tillage.p, , no-till.a",labour.n,,,,,,
1 157,Presence,"present.a, absence.n, presence.n",,,,"presença.n, arraigado.a, afastamento.n, ausência.n, falta.n, afastado.a, faltar.v, presente.a, ausente.a, manifesto.a",,,"saknasaknas.v, närvaro.n, fattafattas.v"
1 158,Presentation_of_mitigation,"anyhow.adv, in any case.adv, at the least.adv, anyway.adv, at least.adv, in any event.adv, at a minimum.adv, at any rate.adv",,,,,,,
1 159,Preserve_in_original_state,", preservation.n, conserve.v, preserve.v, conservation.n","conservation.n, conserver.v, préservation.n, préserver.v",,,"preservar.v, conservação.n, preservação.n, conservar.v",,,
1 160,Preserving,"preservation.n, pickle.v, mummification.n, salt.v, mummify.v, embalming.n, cure.v, can.v, dry.v, preserve.v, embalm.v",,"einbalsamieren.v, einlegen.v, sichern.v, räuchern.v, mumifizieren.v, trocknen.v, konservieren.v",,"preservar.v, tombar.v, preservado.a, conservação.n, preservação.n, conservar.v",,,"luta.v, salta.v, konservering.n, konservera.v"
1 161,Prevarication,"bullshit artist.n, lie.v, fib.n, tell.v, kid.v, pull (someone's) leg.idio, deception.n, dissembler.n, prevaricate.v, dissemble.v, joke.v, deceptive.a, prevarication.n, mislead.v, ""pull the wool over (someones) eyes.idio"", hoodwink.v, bullshit.v, misrepresentation.n, fool.v, pull the wool over (someone's) eyes.idio, lie.n, deceive.v, shit.v, ""pull (someones) leg.idio"", equivocation.n, equivocate.v, misrepresent.v, fib.v",blague.n,,,mentir.v,,,"lögn.n, lura.v, förvilla.v, skoja.v, bluff.n"
1 162,Prevent_or_allow_possession,", starve.v, deprive.v, permit.v, deny.v, allow.v","démunir.v, dépouiller.v","bringen (um).v, nehmen.v",,"permitir.v, privar.v, negar.v",,,
1 163,Preventing_or_letting,", obviate.v, enablement.n, upset.v, preclude.v, preempt.v, avert.v, let.v, check.v, forestall.v, preemptive.a, prohibit.v, stopping.n, preemption.n, allow.v, nip in the bud.v, stop.v, permit.v, avoid.v, frustrate.v, stave off.v, prevent.v, enable.v, prevention.n, keep (from).v","éviter.v, permettre.v",,,"aprovar.v, proibido.a, consentido.a, inadimissível.a, dar-se ao luxo.v, autorização.n, consentir.v, evitar.v, impedir.v, o.adv, inviabilizar.v, autorizar.v, consentimento.n, sancionado.a, deixar.v, permitir.v, aceitação.n, aceitar.v, atropelar.v",,,
1 164,Price_per_unit,rate.n,,"Tarif.n, Preis.n, Rate.n",,,,,"årsavgift.n, avgift.n, importavgift.n, tull.n"
1 165,Prison,"slammer.n, prison.n, brig.n, penitentiary.n, jailhouse.n, correctional institution.n, jail.n, pen.n, stockade.n, joint.n",,,,"cadeia.n, penitenciária.n, prisão.n",,,"fängelse.n, husarrest.n"
1 166,Probability,"odds.n, chances.n, significance.n, likelihood.n, probability.n, chance.n",,"Warscheinlichkeit.n, Chance.n",,probabilidade.n,,,odds.n
1 167,Process,"process.n, conservation.n, renovate.v",processus.n,Prozess.n,,"degenerativo.a, processar.v, processo.n",,,process.n
1 168,Process_completed_state,"finished.a, over.a, complete.a, done.a",,abschließen.v,,completo.a,,,
1 169,Process_continue,"underway.a, continue.v, drag on.v, persist.v, proceed.v, go on.v, ongoing.a, carry.v, on.adv, persistence.n","continuer.v, suite.n","weitergehen.v, fortsetzen.v, durchführen.v, anhalten.v",,"andar.v, correr.v, estar.v, ficar.v, proceder.v, passar.v",,,"pågå.v, hållahållas.v"
1 170,Process_end,"conclude.v, end [cessation].n, end.v, draw to a end.v, come to a end.v, end.n, come to a close.v, finale.n, draw to a close.v, final.a, end [final-subevent].n, pass.v",finir.v,"schließen.v, beschließen.v, ein Ende haben.m, aufhören.v, enden.v, aus sein.v, abschließen.v, ausgehen.v, sich dem Ende zuneigen.m",,"dissipar.v, terminar.v, fim.n, acabar.v, término.n, expirar.v, cair.v",,,"upphöra.v, sluta.v"
1 171,Process_initial_state,,,,,,,,
1 172,Process_pause,,,,,,,,
1 173,Process_resume,"warming.v, warm.a, cool.a, restart.v, cooling.v, resume.v",redémarrage.n,"wiederaufnehmen.v, fortsetzen.v",,"voltar.v, continuar.v, recomeçar.v",n.إعادة-تشغيل,,
1 174,Process_start,"break out.v, electrify.a, come aboard.v, incipient.a, start.v, commencement.n, eruption.n, nascent.a, erupt.v, begin.v, onset.n, electrification.n, commence.v","exécution.n, exécuter.v","anfangen.v, angehen.v, ausbrechen.v, einfallen.v, starten.v, eröffnen.v, kommen.v, beginnen.v, einsetzen.v","comenzar.v, empezar.v, nan","começar.v, entrar.v, incipiente.a, estrear.v, iniciado.a, nascente.a, iniciar.v, surgimento.n, inaugurar.v, início.n, principiar.v, irromper.v, erupção.n, passar.v","n.عمل, n.تشغيل",,"börja.v, starta.v, utbryta.v"
1 175,Process_stop,"cease.v, discontinue.v, kill.v, quit.v, halt.n, stop.v, discontinuation.n, desist.v, shutdown.n, shut down.v, cessation.n",,"aufhören.v, lösen.v, enden.v, einstellen.v, einschlafen.v, auflösen.v",,"parar.v, cessar.v, desistir.v",,,stopp.n
1 176,Process_stopped_state,,,,,,,,
1 177,Process_uncompleted_state,,,,,,,,
1 178,Processing_materials,"weaponize.v, enrich.v, reprocessing.n, etch.v, develop.v, treat.v, urbanization.n, industrialization.n, reprocess.v, spin.v, stain.v, development.n, dye.v, process.n, galvanize.v, process.v, weaponization.n, enrichment.n","traiter.v, traitement.n, conditionnement.n, traitement.n, traiter.v","behandeln.v, brennen.v, klopfen.v",,"processar.v, banhar.v, tratar.v","n.معالجة, v.عالج",,"färga.v, behandla.v, hantering.n, förädla.v, bereda.v, rosta.v, galva.v, bearbeta.v, behandling.n, hantera.v"
1 179,Procreation,", breed.v, breeding.v","reproduction.n, reproduire.a",,,,,,
1 180,Procreative_sex,"make baby.v, mate.n","accouplement.a, accoupler.v",,,procriar.v,,,
1 181,Product_delivery,,,,,"entregar.v, entrega.n",,,
1 182,Product_development,"develop.v, polluting.v, development.n","développer.v, développement.n",entwickeln.v,,,"n.تطوير, v.طور",,
1 183,Product_development,"develop.v, development.n",,entwickeln.v,,"desenvolvimento.n, desenvolver.v",,,
1 184,Product_development_scenario,", extinction.n, disappearance.n, go.v, disappear.v",,,,,,,
1 185,Product_line,"line.n, collection.n",,"Linie.n, Kollektion.n",,"coleção.n, linha.n",,,
1 186,Program_creation,", stabilization.n, stabilize.v","écrire.a, écriture.n, programmer.v, programmation.n",,,,"n.برمجة, n.كتابة",,
1 187,Programming,", acidify.v",paramétrer.v,,,,"n.برمجة, n.ضبط",,
1 188,Progression,"progress.n, advance.n, -, develop.v, progression.n, stagnate.v, mature.v, development.n, advancement.n, advance.v, progress.v, maturation.n, improve.v, burgeon.v","développer.v, grandir.v",,,"progressivamente.adv, desenvolver.v, progressão.n",,,
1 189,Prohibiting_or_licensing,"embargo.n, outlaw.v, sanction.v, ban.v, prohibition.n, allow.v, prohibit.v, ban.n, permit.v, forbid.v, proscribe.v, censorship.n, bar.v, let.v, entitle.v",,,,"aprovação.n, aprovar.v, deixar.v, indicar.v, admitir.v, permitir.v, proibir.v, embargo.n, indicado.a",,,
1 190,Project,"scheme.n, program.n, project.n, plan.n",,"Programm.n, Projekt.n",,"projeto.n, estratégia.n, programa.n, planejar.v",,,"program.n, projekt.n, forskningsprojekt.n"
1 191,Proliferating_in_number,"proliferation.n, proliferate.v, dwindle.v, non-proliferation.n, multiply.v, boom.n",,,,"proliferar.v, explosão.n, multiplicar.v, proliferação.n",,,"uppgå.v, fyrdubbla.v, tredubbla.v"
1 192,Prominence,"quiet.a, prominent.a, blatant.a, flashy.a, eye-catching.a, salient.a, conspicuous.a",,,,,,,framstående.a
1 193,Proper_reference,"proper.a, self.n",,,,próprio.a,,,"självsjälva.a, själv.a, självsäga sig självt:2.a"
1 194,Proportion,rate.n,,Rate.n,,,,,
1 195,Proportional_quantity,"exactly.adv, , nearly.adv, much.art, thereabouts.adv, proportional.a, at least.adv, a maximum of.adv, little.art, around.prep, several.pron, in vicinity (of).prep, circa.prep, a good.a, almost.prep, mostly.adv, close (to).a, something like.prep, under.prep, a little.adv, most.art, odd.a, some.art, at most.adv, barely.adv, tops.n, upwards of.prep, about.prep, or so.adv, over.prep, roughly.adv, precisely.adv, minimum.n, in neighborhood (of).prep, approximately.adv","à peu près.adv, au moins.adv, environ.adv, plupart.n, principalement.adv",,varios.pron,"vários.pron, cerca de.prep, pouquíssimo.adv, praticamente.adv, superior.a, pequeno.a, aproximadamente.adv, pouco.adv, quase.adv, pouquinho.adv, superiormente.adv, muito.adv, pouco.a, mais.adv, até.adv",,,
1 196,Prosthesis,,,,,,,,
1 197,Protecting,"cover.n, shield.n, protect.v, erode.v, protection [event].n, thinning.v, shelter.n, secure.v, guard.v, protection.n, protection [entity].n, rise.v, erosion.n, shelter.v, retreat.n, bulwark.n, shield.v, safeguard.v, safeguard.n, insulate.v","protection.n, protéger.v",,,"proteger.v, protetor.a, amparo.n, proteção.n, abrigamento.n, , protegido.a, acolher.v",n.-,保护.v,"skydda.v, skydd.n, säkerställa.v, försäkranförsäkring.n"
1 198,Protest,"protester.n, movement.n, demonstrate.v, protest.v, protest.n, demonstration.n",,,,"protesto.n, manifestação.n, manifestante.n, protestar.v, , movimento.n",,,protest.n
1 199,Provide_lodging,"lodge.v, house.v, put up.v, host.v",,unterbringen.v,,"receber.v, abrigar.v",,,härbärgera.v
1 200,Proximity_image_schema,,,,,,,,
1 201,Public_services,"public service.n, service.n",public.a,"Service.n, Dienst.n",,"serviço público.n, público.a, serviço.n, serviço de informação ao cidadão.n",,,
1 202,Publishing,"appear.v, release [event].n, release.v, put out.v, publication.n, publish.v",,veröffentlichen.v,,"lançamento.n, publicar.v",,,"publicera.v, publicering.n, utge.v"
1 203,Punctual_perception,"get an eyeful.v, glimpse.n, glimpse.v",,,,vislumbrar.v,,,"ögonkast.n, blick.n"
1 204,Purpose,", bent.a, intend.v, application.n, plan.v, intention.n, mean.v, for.prep, purpose.n, intent.a, aim.v, target.n, plan.n, use.n, in order.adv, objective.n, object.n, goal.n, determined.a, aim.n","afin que.c, but.n, cheval de bataille.n, combat.n, raison d etre.n","anstreben.v, planen.v, ansteuern.v, meinen.v, abzielen.v, vorhaben.v, Ziel.n, zum Ziel setzen.m, denken.v, Absicht.n, bedenken.v","aspirar.v, pretender.v, para.prep","intuito.n, objetivo.n, objetivar.v, visar.v, pretendido.a, determinado.a, pra.prep, objetivo.a, planejado.a, roteiro.n, para.prep, planejar.v, alvo.n, pretender.v, objeto.n, resolvido.a, para que.scon, intenção.n, de modo a.scon, plano.n, motivo.n, de.prep, se.c, uso.n, finalidade.n, propósito.n, proposta.n, ser.aux, destinado.a, destinar.v",,,"ändamål.n, ämna.v, uppsåt.n, planera.v, syfte.n, mål.n, plan.n, syfta.v, avse.v, målsättning.n, ambition.n"
1 205,Putting_out_fire,"smother.v, stamp out.v, snuff out.v, douse.v, blow out.v, put out.v, extinguish.v, quench.v",,löschen.v,,"apagar.v, extinguir.v",,,
1 206,Quality,,,,,,,,
1 207,Quantified_mass,"abundance.n, a lot.n, amount.n, touch.n, mite.n, quantity.n, ton.n, few.n, mountain.n, pile.n, torrent.n, wave.n, ounce.n, any.a, handful.n, mass.n, few.a, both.a, a bit.n, dozens.n, hundreds.n, scores.n, all.a, smattering.n, load.n, millions.n, trace.n, no.a, shitload.n, flood.n, deal.n, numerous.a, avalanche.n, a few.art, measure.n, weight.n, fair.a, dose.n, myriad.n, scads.n, trickle.n, oodles.n, degree.n, many.a, billions.n, plethora.n, several.a, pinch.n, multiple.a, a little.n, deluge.n, many.n, number.n, several.n, stream.n, modicum.n, thousands.n, raft.n, heap.n","aucun.a, aucun.a, beaucoup.adv, beaucoup.adv, certain.a, certain.a, chaque.a, chaque.a, nombreux.a, nombreux.a, quelque.a, quelque.a, tout.a, tout.a, un peu.adv, un peu.adv",,miles.n,"dosar.v, centena.n, ponderal.a, tudo.pron, peso.n, menor.a, nenhum.pron, todo.a, pesar.n, medida.n, todos.n, pouco.a, quilo.n, número.n, , maioria.n, muito.a",,,"allt.adv, åtskillig.a, mängd.n, massa.n, portion.n, godgott.a, mycken.a, folkmassa.n, lövhög.n, godgotttala gott:2på gott och ont:7.a, dos.n, fåtal.n"
1 208,Quantity,"amount.n, extent.n, quantity.n, level.n, number.n, less.adv, degree.n",,,,"diverso.a, lote.n, menor.a, maior.a, , bom.a, sem.prep, cento.n, série.n, bastante.a, um monte de.adv, tanto.a, nada.adv, quantidade.n, tempo.n, menos.adv, mais ou menos.adv, mais.adv, muito.a",,,"belopp.n, antal.n"
1 209,Quarreling,"wrangle.n, wrangle.v, quarrel.n, row.v, squabble.v, tiff.n, fight.v, row.n, quibble.v, disagreement.n, bickering.n, argue.v, spat.n, altercation.n, squabble.n, disputation.n, argument.n, dispute.n, bicker.v, wrangling.n, fight.n, quarrel.v",,,,"protesto.n, lutar.v, argumento.n, discutir.v",,,"tvist.n, konfrontera.v"
1 210,Questioning,"query.v, interrogation.n, inquiry.n, grill.v, interrogate.v, ask.v, inquire.v, question.n, question.v, questioning.n, query.n, quiz.v","demander.v, interroger.v, questionner.v",,"encuesta.n, objetar.v, preguntar.v, encuestar.v, pregunta.n, interrogar.v, encuesta.n, interrogatorio.n, preguntar.v\n, interpelar.v","questionamento.n, dúvida.n, pergunta.n, questionar.v, perguntar.v",,,"fråga.n, frågafråga sig.v, fråga.v, förhöra.v, frågai fråga:15.n, frågai fråga:1i fråga om:1.n, undra.v"
1 211,Quitting,"retirement.n, retire.v, step down.v, quit.v, stand down.v, give notice.idio, leave.v, resignation.n, resign.v",retraite.n,,,aposentar.v,,,
1 212,Quitting_a_place,"emigre.n, emigrant.n, desert.v, retreat.v, withdrawal.n, defection.n, sally.v, abandon.v, quit.v, emigration.n, emigrate.v, split.v, bolt.v, vamoose.v, withdraw.v, vacate.v, desertion.n, retreat.n, skedaddle.v, defect.v, escapee.n",,,,"deserção.n, retirada.n, separado.a, exilado.n, demitir.v, , retirar.v, investir.v, separar.v, fugir.v, emigrante.n, desertar.v, abandonar.v, fugitivo.n, emigrar.v, desocupar.v, deixar.v, emigração.n, remover.v",,,utvandring.n
1 213,Race_descriptor,"color.n, white.a, hispanic.a, asian.a, yellow.a, black.a",,,,,,,
1 214,Range,"sight.n, distance.n, reach.n, view.n, intercontinental.a, earshot.n, strike.n, range.n",,,,"distância.n, vista.n",,,
1 215,Rank,"level.n, baseline.n, order.n, rank.n, degree.n",,Rang.n,grado.n,"graduação.n, , lugar.n",,,grad.n
1 216,Ranked_expectation,"whole.a, entire.a, mere.a","en entier.adv, entier.a","gesamt.a, ganz.a, lediglich.a",,"apenas.adv, geral.a, dimensão.n, tamanho.a, mero.a, todo.a, inteiro.a",,,"helhelt.adv, hel.a, heli det stora hela:4.a, helhelthelt enkelt.adv, helhela vägen.a, heli det hela:9.a, heli hela världen:7.a, helför hela slanten:13.a"
1 217,Rape,"raped.a, rape.n, rape.v, sexually assault.v, rapist.n",,nehmen.v,,"estuprar.v, , estupro.n",,,våldtäkt.n
1 218,Rashness,"rash.a, impatient.a, precipitate.a, precipitous.a, impetuous.a, patient.a",,,,paciente.a,,,impulsiv.a
1 219,Rate_description,"rapidly.adv, rapid.a, fast.a",,,,"rápido.a, rapidamente.adv",,,
1 220,Rate_quantification,rate.n,,"Frequenz.n, Geschwindigkeit.n, Rate.n",,taxa.n,,,
1 221,Ratification,"ratify.v, ratification.n",,,,"ratificação.n, , ratificar.v",,,ratificering.n
1 222,Reading_activity,read.v,lire.v,,,ler.v,,,
1 223,Reading_aloud,"read out.v, read.v",,,,ler.v,,,
1 224,Reading_perception,"peruse.v, intensification.n, acceleration.n, intensify.v, devour.v, perusal.n, scan.v, literacy.n, read.v, pore.v, accelerate.v, skim.v, reader.n","lire.v, lecture.n",,,"leitor.n, ler.v, leitura.n","n.قراءة, v.قرأ",,
1 225,Reason,"motivation.n, reason.n, basis.n, why.n, motive.n","pourquoi.c, raison.n",,,"princípio.n, por que.adv, por isso.c, razão.n, por.prep, sentido.n, porquê.n",,,"skäl.n, anledning.n, motiv.n, förevändning.n"
1 226,Reasoning,"disprove.v, reason.v, argue.v, argument.n, demonstrate.v, case.n, prove.v, show.v, reasoning.n, polemic.n, demonstration.n",,,,argumentação.n,,,"resonemang.n, resonera.v"
1 227,Reassuring,"reassure.v, reassurance.n",,"versichern.v, beruhigen.v",,tranquilizar.v,,,försäkra.v
1 228,Rebellion,"rebel.n, insurgency.n, insurgent.n, insurgence.n, insurge.v, rebel.v",,"Rebellion.n, rebellieren.v, Revolte.n, Aufstand.n",,"rebelde.n, insurgir.v, rebelar.v",,,"uppror.n, resning.n"
1 229,Receive_visitor_scenario,,,,,"receber.v, receptivo.a",,,
1 230,Receiving,"accept.v, frost.n, receipt.n, freeze.v, melting.v, busk.v, receive.v, thaw.n, melt.v, thawing.v",recevoir.v,,"recibir.v\n, percibir.v, recibir.v, percibir.v","ter.v, ganhar.v, aceitar.v, receber.v, herdar.v","v.استقبل, n.استقبال",,"få.v, fåfå fast.v, erhålla.v, fåfå smak.v, fåfå lov.v, fåfå fatt.v, fåfå syn.v, fåfå tag.v, mottagande.n, fåfå för sig.v, fåfå till.v, fåfå ihop.v, fåfå nog.v, fåfå bukt.v, fåfå rätt.v, fåfå reda.v"
1 231,Receiving_scenario,,,,,,,,
1 232,Reciprocality,,,,,,,,
1 233,Reciprocality_focus,,,,,,,,
1 234,Reciprocality_subordinate_event,,,,,,,,
1 235,Recording,"chronicle.v, record.v, document.v, register.v",,,,"constar.v, documentar.v, registrar.v",,,loggalogga in.v
1 236,Records,"CD.n, record.n, vinyl.n, recording.n, book.n, journal.n, medium.n, log.n",,"Aufzeichnung.n, Buchhaltung.n, Buch.n, Protokoll.n",,"obra.n, cópia.n, LP.n, disco.n, edição.n, vinil.n, álbum.n, CD.n",,,journal.n
1 237,Recover,", recover.n","récupération.n, récupérer.v, valorisation.n, valoriser.v",,,,,,
